{
 "slug": "hobbs-angel-of-death",
 "name": "Hobbs' Angel of Death",
 "extractor_version": "0.3.0",
 "ids": {
  "itunes": 1728929605,
  "deezer": 1227885,
  "spotify": "0lZPfJ4u0Kya50n6MKbuX4"
 },
 "metadata": {
  "formed": 1987,
  "split": 2019,
  "country": "AU",
  "status": "split-up",
  "members": 4,
  "past_members": 23,
  "full_lengths": 3,
  "genre": "Thrash Metal",
  "vocals": "clean",
  "instrumental": false,
  "fans": 361,
  "themes": "Satan, Hell, History, Violence, Sex",
  "release_year": 2016
 },
 "partial": false,
 "clips": [
  "hobbs-angel-of-death/1729895513-106",
  "hobbs-angel-of-death/1729895513-107",
  "hobbs-angel-of-death/1729895513-105",
  "hobbs-angel-of-death/1729895513-108",
  "hobbs-angel-of-death/1729895513-104",
  "hobbs-angel-of-death/1729895513-109",
  "hobbs-angel-of-death/1729895513-103",
  "hobbs-angel-of-death/1729895513-110",
  "hobbs-angel-of-death/1729895513-102",
  "hobbs-angel-of-death/1729895513-111",
  "hobbs-angel-of-death/1729895513-101",
  "hobbs-angel-of-death/1729895513-112"
 ],
 "features": {
  "tempo_bpm": {
   "median": 107.666015625,
   "iqr": 32.470703125
  },
  "onset_rate": {
   "median": 6.8998956931868,
   "iqr": 1.9333041072697315
  },
  "tempo_var": {
   "median": 10.882285034186676,
   "iqr": 12.897721530856373
  },
  "low_onset_rate": {
   "median": 7.6998835996432415,
   "iqr": 1.849972033680519
  },
  "lufs": {
   "median": -10.277644016746729,
   "iqr": 0.8819691043184008
  },
  "rms_dbfs": {
   "median": -10.380878589489651,
   "iqr": 1.1923568496882915
  },
  "crest": {
   "median": 10.380878448486328,
   "iqr": 1.1923561096191406
  },
  "centroid": {
   "median": 3033.4129416470614,
   "iqr": 220.59518606177016
  },
  "flatness": {
   "median": 0.0554522555321455,
   "iqr": 0.012622234411537647
  },
  "sub100_share": {
   "median": 0.3044329583644867,
   "iqr": 0.06738495081663132
  },
  "lowest_pitch": {
   "median": 47.1038818359375,
   "iqr": 20.1873779296875
  },
  "harmonic_share": {
   "median": 0.7551409304141998,
   "iqr": 0.06341053545475006
  },
  "clean_share": {
   "median": 0.0,
   "iqr": 0.0007733952049497294
  },
  "minor_share": {
   "median": 0.056575183746694874,
   "iqr": 0.178800997771085
  },
  "chord_rate": {
   "median": 1.5833093981950386,
   "iqr": 0.549991685688803
  },
  "repetitiveness": {
   "median": 0.8606289327144623,
   "iqr": 0.05625006556510925
  },
  "vocal_share": {
   "median": 0.11947355791926384,
   "iqr": 0.04602326825261116
  },
  "vocal_voiced": {
   "median": 0.2528157890852191,
   "iqr": 0.23760551336845837
  },
  "song_length": {
   "median": 261.95349999999996,
   "iqr": 101.71825000000001
  },
  "vocal_presence": {
   "median": 0.8333333333333334,
   "iqr": 0.0
  }
 },
 "hand": {
  "persona": 0.3,
  "camp": 0.4
 },
 "sources_failed": []
}